# Astro content on Youtube

[Master Playlist](https://www.youtube.com/playlist?list=PLzH1dqcPw_N0MNuoZNSmlLmGj-H3rnb7B) | [Videos](#videos) | [Livestreams](#livestreams) | [Series](#series)
---|---|---|---

## Videos

- [Astro's "Hello, World" is so simple compared to others (Fred K. Schott) - Changelog](https://www.youtube.com/watch?v=GqcBgaTz720) 1:08
- [Jamstack Ecosystem Innovation Award: Astro - Jamstack TV](https://www.youtube.com/watch?v=6SKbkK1uzok) 1:35s
- [What are Islands? - Astro](https://www.youtube.com/watch?v=6F-lQe_BzeM) 2:08s
- [Astro in 100 seconds - Fireship](https://www.youtube.com/watch?v=dsTXcSeAZq8) 2:17s
- [ASTRO 1.0: Bringing the Future TODAY! - James Perkins](https://www.youtube.com/watch?v=2APjox1s7Ek) 2:19s
- [Create and Deploy Your Astro Site Today! - Netlify](https://www.youtube.com/watch?v=SknFflQVOys) 2:28s
- [Astro just Launched.... Could it be the ultimate web framework? - Fireship](https://www.youtube.com/watch?v=gxBkghlglTg) 3:17s
- [What is ASTRO JS & How To Run it - Norbert BM Web Development](https://www.youtube.com/watch?v=oY10C8W53KE) 3:23s
- [Islands Architecture explained (by Astro's Fred K. Schott) - Changelog](https://www.youtube.com/watch?v=e-vEFRtk4-0) 4:02s
- [How to manage state in Astro applications? - CodeWithLuke](https://www.youtube.com/watch?v=R3N_zg7Lz6Q) 4:06s
- [Setting up a new Astro project in Gitpod - Sarah Rainsberger](https://www.youtube.com/watch?v=fxkkh3oE48Y) 4:32s
- [Content Collections are game changing - James Perkins](https://www.youtube.com/watch?v=BvpkX1OEReI) 4:51s
- [ASTRO Import Aliases | Tutorial | Static Site Generator SSG JavaScript JS Markdown MD Components - Future Web Design](https://www.youtube.com/watch?v=Kp1e5iew-hg) 4:58s
- [Demo of WPGraphQL JWT Auth with Astro and Vue - WP Engine Builders](https://www.youtube.com/watch?v=oYUqID-9KF0) 5:18s
- [Add Responsive YouTube Videos to Astro.JS MDX - Bit Doze](https://www.youtube.com/watch?v=NkShQ1wwiCg) 5:24s
- [Using Astro with YOUR favourite UI library (React example) - Eddie Jaoude](https://www.youtube.com/watch?v=SoezjkNppkE) 5:32s
- [Don't make me think - Awesome](https://www.youtube.com/watch?v=xultIkhPoCc) 5:39s
- [Vue and Astro Simplified - LearnVue](https://www.youtube.com/watch?v=1BU12Z5w_FU) 5:45s
- [What is Astro and how you can use it to build fast websites - Padakoo](https://www.youtube.com/watch?v=PX3yA7ybb78) 5:57s
- [Astro Site with Netlify Functions, Forms, and Redirects - Netlify](https://www.youtube.com/watch?v=GrSLYq6ZTes) 6:10s
- [What Is Astro - What is Web Development Weekly - LevelUpTuts](https://www.youtube.com/watch?v=XphKgi9Jr8I) 6:13s
- [Make your website even faster with Astro! - Tim Benniks](https://www.youtube.com/watch?v=O8m4cS3o4II) 6:17s
- [Astro Build: how to use React, Vue and Svelte in the same page using "islands" - Fabio Biondi - Front-End Tutorials](https://www.youtube.com/watch?v=hBzlb5ZxsKo) 6:30s
- [How to use TAILWIND in ASTRO - A shot of code](https://www.youtube.com/watch?v=Aihhv-Xo5Ck) 6:47s
- [Intro to Astro + Svelte - Svelte Mastery](https://www.youtube.com/watch?v=7ClGgtwn3bY) 6:56s
- [Create Site Maps with ASTRO | Tutorial | Static Site Generator SSG JavaScript JS - Future Web Design](https://www.youtube.com/watch?v=ZHop5-8CGj4) 7:07s
- [Why Use Astro - Chris Hawkes](https://www.youtube.com/watch?v=8mE1Auts20Q) 8:07s
- [What is Astro? - Kodaps Academy](https://www.youtube.com/watch?v=oQDErNNzdwU) 8:15s
- [Updating my Astro + Sanity Minimal Starter! (Sanity Block Content To React) - Little Sticks](https://www.youtube.com/watch?v=dB7CmFLQiSs) 8:28s
- [How I hosted my Astro website - Web Dev Cody](https://www.youtube.com/watch?v=0x0IPGpBxCM) 8:34s
- [Create a Custom Blog with Astro & NetlifyCMS in MINUTES! - Kumail Pirzada](https://www.youtube.com/watch?v=3yip2wSRX_4) 8:56s
- [Astro: less JavaScript, Faster Website - Elian Van Cutsem - BeJS](https://www.youtube.com/watch?v=6llrwAmzKY0) 9:01s
- [Why Astro will be your favorite web app framework - DevTrends](https://www.youtube.com/watch?v=qEUzK1g9Hu8) 9:18s
- [Astro JS is here to stay - Awesome](https://www.youtube.com/watch?v=npmalb821gc) 9:19s
- [ASTRO Dynamic Title Tag | Tutorial | Static Site Generator SSG JavaScript JS - Future Web Design](https://www.youtube.com/watch?v=Rg7Finb-Uxw) 9:24s
- [Astro Lightning Launch: Astro v 0.21 with Matthew Phillips - Jamstack TV](https://www.youtube.com/watch?v=fop0HoArXxE) 9:31s
- [WTF?! Building a new tool to help you choose your next JavaScript framework — Built with Astro - whitep4nth3r](https://www.youtube.com/watch?v=2ECq6-FKIBE) 9:36s
- [Introduction To Astro and Vue 3 - John Komarnicki](https://www.youtube.com/watch?v=e9NV6mBKe30) 10:12s
- [Tutorial | RSS feeds with Astro | Static Site Generation | Blogs - Future Web Design](https://www.youtube.com/watch?v=yI_QJxbQwUk) 10:16s
- [Astro IS SO GOOD - ThePrimeagen](https://www.youtube.com/watch?v=Sqp5VSqbQOY) 11:15s
- [How I built my website with Astro - A short introduction to astro.build - Weibenfalk](https://www.youtube.com/watch?v=igNXhXTthes) 11:20s
- [Typesafe Markdown With Astro Content Collections - Learn with Jason](https://www.youtube.com/watch?v=TfD4RW2gR-s) 12:31s
- [Adding a Click to Copy Code Block to the Astro & Sanity Starter - Little Sticks](https://www.youtube.com/watch?v=WVRLCaRfg8E) 12:32s
- [I Tried Astro Build and I LOVE IT - 5 Reasons You Will TOO! - James Q Quick](https://www.youtube.com/watch?v=wND4lSml31A) 12:47s
- [Astro Google Analytics Integration - Quick & Easy - Stefan Rows](https://www.youtube.com/watch?v=HHQzJtgeSC4) 12:57s
- [Astro Icon Component (Warning: it may make you try Astro!) - Coding in Public](https://www.youtube.com/watch?v=8LRY7-985yE) 13:19s
- [Create Your Own Blog with Astro and Sanity.io as a Headless CMS - Little Sticks](https://www.youtube.com/watch?v=-jAWLTfsSQw) 13:46s
- [Creating your first Astro Layout - Sarah Rainsberger](https://www.youtube.com/watch?v=9bVuIBD70wc) 14:06s 
- [Intro to ASTRO with MARKDOWN | Static Site Generator SSG JavaScript JS - Future Web Design](https://www.youtube.com/watch?v=ooTxbWnuP5c) 14:08s
- [How to make the Perfect Website w/ Astro & React - CreativeJE](https://www.youtube.com/watch?v=73WQ6Ts54hg) 14:08s
- [How Astro Made My Site 100x Faster - James Perkins](https://www.youtube.com/watch?v=cOxA3kMYtkM) 15:00s
- [Optimize Images & Dynamically Resize in Astro with Cloudinary - Colby Fayock](https://www.youtube.com/watch?v=bwGFqqS4gIE) 16:04s
- [Let's Checkout... #Astro - Watch and Learn](https://www.youtube.com/watch?v=m08eXKqkpKE) 16:10s
- [Astro is Gatsby done right. (Static sites without the JavaScript) - Eric Murphy](https://www.youtube.com/watch?v=sGCjoa5z2nU) 16:47s
- [AstroJS - The JavaScript Meta Framework you'll WANT to use - Ray Villalobos](https://www.youtube.com/watch?v=OJU99zHr-mI) 16:51s
- [Working with APIs in Astro is AMAZING! - Stefan Rows](https://www.youtube.com/watch?v=iX-mTitP4aE) 17:03s
- [Taking Astro for a ride - portfolio edition - YuriCodesBot](https://www.youtube.com/watch?v=QkY_rZpjEew) 17:17s
- [Build a static blog with Astro, a new kind of frontend framework - Little Sticks](https://www.youtube.com/watch?v=CzMQmkce94g) 17:37s
- [Astro -- Going Fast Without JavaScript Bloat - Spooky Software](https://www.youtube.com/watch?v=GWH8CdQfN38) 18:05s
- [Moving the Astro + Sanity Starter to GROQ - Little Sticks](https://www.youtube.com/watch?v=f0hBC_Df3vc) 18:32s
- [AM Coder - Even more Astro SSG Features, Markdown Pages/Component, Collections, Partial Hydration - Alex Merced - Full Stack Developer](https://www.youtube.com/watch?v=GnbkHMZJX9k) 18:56s
- [Bun vs Node: Round 2 (feat. Astro, Deno, Fresh and more) - Jack Herrington](https://www.youtube.com/watch?v=qCX8rw4qOSA) 19:31s
- [Build React Apps without JavaScript using Astro - Static Web App Tutorial - Colby Fayock](https://www.youtube.com/watch?v=-5UPq7Lv9Sc) 21:06s
- [Create a Link in Bio Page for Instagram with Sanity.io - Little Sticks](https://www.youtube.com/watch?v=GNFr8uHG0rw) 21:10s
- [Add Copy To Clipboard Buttons To Code Blocks - Little Sticks](https://www.youtube.com/watch?v=_0eBQREJTDo) 21:59s
- [Astro Crash Course in 20 Minutes! - Coding in Public](https://www.youtube.com/watch?v=zrPVTf761OI) 22:06s
- [Islands Architecture, Astro, and You | Nate Moore | ViteConf 2022 - ViteConf](https://www.youtube.com/watch?v=SICd8tTEqvs) 22:17s
- [Build and Deploy a Blog with Astro - The Next-gen Framework // Astro JS Tutorial](https://www.youtube.com/watch?v=MDSlG1CzTV8) 22:41s
- [Odyssey Theme for Astro & We're Rebranding!! - Little Sticks](https://www.youtube.com/watch?v=7B74jDONNdk) 22:48s
- [Advanced Astro | Using React with Astro, Pagination And More - CodeLit](https://www.youtube.com/watch?v=yuvKqZdkqa8) 22:54s
- [The less Javascript, the better - Stack Overflow](https://www.youtube.com/watch?v=W3Cwno3Reec) 24:24s
- [Create template layouts for your HTML with Astro SSG - Kevin Powell](https://www.youtube.com/watch?v=o7iQAF2EvUU) 24:28s
- [Astro 2.0 is Revolutionary! Again! - Jack Herrington](https://www.youtube.com/watch?v=gi4c7fbeURc) 26:04s
- [AM Coder - Astro! Use React, Svelte, Vue and Web Components in one Static Site Generator! (Overview) - Alex Merced - Full Stack Developer](https://www.youtube.com/watch?v=ncj-KwGutBc) 26:21s
- [Yapping About Astro - CSS-Tricks](https://www.youtube.com/watch?v=3jPaidbpUIA) 26:38s
- [How To Deploy An Astro.JS Blog On Cloudflare - Bit Doze](https://www.youtube.com/watch?v=an0DrjkrUoc) 27:11s
- [Astro - Complete tutorial - yoursTRULY](https://www.youtube.com/watch?v=Mh3tVohMNmQ) 28:38s
- [95.7% Faster?? I Rewrote My First Next/React App - Theo - t3.gg](https://www.youtube.com/watch?v=vP3QVrveSvI) 29:46s
- [First steps with Astro - Alvaro Dev Labs](https://www.youtube.com/watch?v=ApHo82GBkwg) 32:47s
- [Stories from the Blok #7: Intro to Astro - Storyblok](https://www.youtube.com/watch?v=il5voBwU2Hk) 32:53s
- [Getting started with astro.build featuring bholmesdev - whitep4nth3r](https://www.youtube.com/watch?v=A3HDN_dPq7k) 32:56s
- [Integrate Astro and Sanity with our new Astro Integration! 🚀 - Little Sticks](https://www.youtube.com/watch?v=NM0FPzVdeUw) 35:27s
- [Let's Create a Splashy Splash Page with Astro 💦 - Little Sticks](https://www.youtube.com/watch?v=o58kSpPMuuI) 36:42s
- [Sarah Rainsberger - Happy Contributors, High Standards pick two! Balancing quality and community - Write the Docs](https://www.youtube.com/watch?v=emgFALmCyrY) 37:35s
- [Take your Astro blog to the next level - James Perkins](https://www.youtube.com/watch?v=IEpP05XSwWE) 42:26s
- [NextJS to Astro: more control = faster sites - Jack Herrington](https://www.youtube.com/watch?v=PSzCtdM20Fc) 43:27s
- [Using Astro.build - Vue.js Frankfurt meetup - Vue Germany](https://www.youtube.com/watch?v=htPQ1JIy1-o) 44:21s
- [How To Create a Link in Bio Page for Instagram with Astro - Little Sticks](https://www.youtube.com/watch?v=elKCpg7TerA) 44:48s
- [Deep dive into Astro v1.0, a JavaScript Framework - Thomas Reggi](https://www.youtube.com/watch?v=ua1HyjKcDnw) 47:38s
- [Astro Crash Course | Most Of Astro In One Video - CodeLit](https://www.youtube.com/watch?v=YAXiDgaTMjE) 50:31s
- [New Astro 2.0 👨‍🚀🚀 Content Collections API Deep Dive - Coding in Public](https://www.youtube.com/watch?v=zUmqmuSvJMs) - 53:05s
- [Build and host a website in under an hour using Astro - AnuRock.dev](https://www.youtube.com/watch?v=A_zOkryRiF0) 57:01s
- [Responsive Website with Navbar, Sidebar and Dropdown Menus | React, Tailwind CSS, Astro JS - Carlos Mafla](https://www.youtube.com/watch?v=u5_3Ze3nHwQ) 1:00:07s
- [Astro Crash Course - Traversy Media](https://www.youtube.com/watch?v=Oi9z5gfIHJs) 1:35:18s
- [Building a Blog with Astro 1, Typescript and TailwindCSS 2022 - Simon Sorensen](https://www.youtube.com/watch?v=LGHWt_EAtb4) 1:39:36s
- [How to create a 'What I Use' blog with Astro and Tailwind CSS (at a hotel lounge) - devaslife](https://www.youtube.com/watch?v=3_JE76PKBWE) 1:57:23s
- [My next blog in Astro - chantastic](https://www.youtube.com/watch?v=OTAUH830iLY) 2:03:34s

## Livestreams

- [Build Faster Websites, Ship Less JavaScript - Open Source Friday - Github](https://www.youtube.com/watch?v=vTgTNVrOXZY) 33:01s
- [Static Feedback #5 — Whiteboard the Web and Astro with Ben Holmes - CloudCannon](https://www.youtube.com/watch?v=CZcNgDN81Sw) 37:11s
- [Tips for documenting your framework with Astro - Open Source Friday - Github](https://www.youtube.com/watch?v=B1ejSMzr0n4) 40:46s
- [What's new in Astro 2.0? - Open Source Friday - Github](https://www.youtube.com/watch?v=NR2msmLYV7g) 42:42s
- [Episode 48 - Astro with Fred Schott - FSJam](https://www.youtube.com/watch?v=17BB0TkRL80) 44:27s
- [How I Turned 70kb PNG into a 1.5kb WEBP with astro-image; upgrading my blog to Astro 1.0 - Parasocial Fix](https://www.youtube.com/watch?v=p_wY0odTYsA) 49:29s
- [Building fast, content-focused websites with Astro - CodeSandbox](https://www.youtube.com/watch?v=q9-l6jmCmiU) 51:05s
- [Speakeasy JS – Astro: A New Architecture for the Modern Web (Fred K. Schott) - Feross](https://www.youtube.com/watch?v=mgkwZqVkrwo) 53:55s
- [Static Site Generation with Astro Build, Build IT Better: Platform (ft. Fred K. Schott) - This Dot Media](https://www.youtube.com/watch?v=0GSFb5xTQEY) 54:56s
- [Coding Design Systems - ep08 - Building in Astro with Matthew Phillips - Backlight](https://www.youtube.com/watch?v=IF3sfyobdFE) 56:44s
- [Fred K. Schott - Snowpack, Astro - devtools-fm](https://www.youtube.com/watch?v=1i9Wm7dP1Aw) 57:22s
- [2.11 - Build faster websites-with Astro - PurrfectDev](https://www.youtube.com/watch?v=x3hiyWikdrE&list=PLGkO2vaNEBBJOAWvCG0BmbJp102NzBhj-&index=3) 59:06s
- [Astro Demo Day - September Edition - Astro](https://www.youtube.com/watch?v=-ExcBJrXOd8) 59:15s
- [Code & Chill with Storyblok #3 - Astro Edition - Storyblok](https://www.youtube.com/watch?v=_UpwoeZjV-c) 1:01:47s
- [Astro 2.0 with Fred K. Schott (JS Party Live!) - Changelog](https://www.youtube.com/watch?v=CJamBV6Cwr8) 1:02:14s
- [🛑 Building FAST Websites with Astro 🚀 - Simon Grimm](https://www.youtube.com/watch?v=CmwkWouL_OU) 1:04:01s
- [How Astro Used Astro to Build Astro - Astro](https://www.youtube.com/watch?v=Hoe-woAhq_k) 1:04:22s
- [Astro from the Ground Up - Certified Fresh Events](https://www.youtube.com/watch?v=9juD4JVGmfc) 1:04:55s
- [Astro and Svelte - Svelte Society](https://www.youtube.com/watch?v=iYKKg-50Gm4) 1:04:57s
- [React Wednesdays: Learning Astro with Nate Moore - Kendo UI](https://www.youtube.com/watch?v=def9EgQzRUw) 1:05:19s
- [Astro with Fred K. Schott (JS Party Live!) - Changelog](https://www.youtube.com/watch?v=3wVO68Petnk) 1:05:28s
- [Making the Web Weird Again with Astro with Ben Holmes - James Q Quick](https://www.youtube.com/watch?v=A8pE-iznJm4) 1:06:12s
- [How I created my personal website with Astro, Tailwind and Nx - Nx - Smart, Fast, Extensible](https://www.youtube.com/watch?v=z8W7WfMVVCM) 1:06:47s
- [Astro with Fred K. Schott - JSJ 561 - Top End Devs](https://www.youtube.com/watch?v=jktNwk8-DKs) 1:07:28s
- [Building faster websites with Astro - Visual Studio Code](https://www.youtube.com/watch?v=0eka27P4Pr4) 1:09:22s
- [Adding a Uses Page Using Astro - James Q Quick](https://www.youtube.com/watch?v=Sb4Mb4pCTe8) 1:19:32s
- [Astro Website Redesign! - James Q Quick](https://www.youtube.com/watch?v=zX6pYvjU50s) 1:19:35s
- [Astro SSR with Ben Holmes - Episode 5, AJC and the Web Devs - Anthony Campolo](https://www.youtube.com/watch?v=M93ImyH7hTI) 1:20:42s
- [🥇 Astro 1.0 Hackathon Award Ceremony 🥇](https://www.youtube.com/watch?v=l3FKc4A8_5A) 1:23:12s
- [Let's Build react.holiday with Astro - lunchdev](https://www.youtube.com/watch?v=BRqwdUAK3z0) 1:24:57s
- [Building with Astro x Wordpress - feat Jeff Everhart! - Ben Holmes](https://www.youtube.com/watch?v=Jstqgklvfnc) 1:25:13s
- [Edge render anything with Astro, with Ben Holmes, Software Developer @ astro.build - Nick Taylor](https://www.youtube.com/watch?v=E19r1WuRycM) 1:27:53s
- [Smooth Page Transitions with Astro & the Shared Element Transition API - Learn With Jason](https://www.youtube.com/watch?v=6mv0_jsWhoE) 1:27:59s
- [web.talks: Getting Started with Astro - PWA Pilipinas](https://www.youtube.com/watch?v=dZF_3_vUceY) 1:28:45s
- [Making documentation developers love with Sarah Rainsberger - Kelvin Omereshone](https://www.youtube.com/watch?v=YW4IfoJM30g) 1:28:50s
- [Ship Less JavaScript with Astro (with Fred K. Schott) — Learn With Jason](https://www.youtube.com/watch?v=z15YLsLMtu4) 1:29:08s
- [Astro Added SSR??! Fred K Schott on Web Dev Wednesday - Theo - t3.gg](https://www.youtube.com/watch?v=fp3mYVoMN7w) 1:29:46s
- [What’s New in Astro v1? - Learn With Jason](https://www.youtube.com/watch?v=Wh1x5SYN5y0) 1:30:39s
- [Port a Blog to Astro - Learn With Jason](https://www.youtube.com/watch?v=53mVg45Rdxg) 1:30:50s
- [New Website Design With Astro - James Q Quick](https://www.youtube.com/watch?v=pgRyuhYt-XA) 1:41:14s
- [Lift Off with the Astro v1 Beta (with Ben Holmes) | Some Antics - Ben Myers](https://www.youtube.com/watch?v=tKiZ_VTE0w4) 1:43:27s
- [Astro Website Redesign Continued - James Q Quick](https://www.youtube.com/watch?v=9t3lfiW0CTI) - 1:43:40s
- [Building a Portfolio with Astro - Agora Devs](https://www.youtube.com/watch?v=0kVmdaIquJc) 1:47:19s
- [[Ep 2 - Full Stream] Astro 1.0 Web Framework is out! Let's check it out - donvitocodes](https://www.youtube.com/watch?v=YrqBk9B6tZI) 1:47:42s
- [Working on My Personal Site with Astro - James Q Quick](https://www.youtube.com/watch?v=P59X61bApR0) 1:50:16s
- [[Full stream recording] Playing with a new way to import Contentful data into Astro? - Ben Holmes](https://www.youtube.com/watch?v=E4X6giOaQlw) 1:50:57s
- [Exploring YOUR Astro 1.0 Hack Submissions! - Ben Holmes](https://www.youtube.com/watch?v=fazV5OEUVDo) 1:51:39s
- [Designing a Blog with Astro and TailwindCSS - Josh Medeski](https://www.youtube.com/watch?v=jWsRpho_vII) 1:53:46s
- [I Try Astro For the First Time! - James Q Quick](https://www.youtube.com/watch?v=2H9T1-H5V3M) 1:54:18s
- [Blasting Off with Astro 1.0! - Alex Trost](https://www.youtube.com/watch?v=Sxz17o5EmrA) 1:59:38s
- [Building with Astro & Prismic - w/ Nate Moore - Alex Trost](https://www.youtube.com/watch?v=qFUfuDSLdxM) 2:02:51s
- [Live Code: Google I/O 2022 Homepage Clone (Astro SSG + Tailwind CSS) - Coding in Public](https://www.youtube.com/watch?v=Bo9s7SjZ170) 2:07:05s
- [Live Code: Astro Static Site Generator Build (real coffee website!) - Coding in Public](https://www.youtube.com/watch?v=59N0wkvf12I) 2:27:23s
- [Let's make a Web product page for my iOS App using Astro.build - Peter Witham](https://www.youtube.com/watch?v=UZM1CSJ7l5M) 2:29:17s
- [Live coding with Astro and some tech rants too - Theo - t3.gg](https://www.youtube.com/watch?v=o-S7sVpH7Y8) 2:39:54s
- [Streaming SolidJS - First look at Astro - Ryan Carniato](https://www.youtube.com/watch?v=UPhx3OxUH0w) 3:00:25s
- [Astro SSR w/ Fred K. Schott - Ryan Carniato](https://www.youtube.com/watch?v=2ZEMb_H-LYE) 3:02:49s
- [STREAM VOD: Astro 1.0, SolidStart/Remix Drama, Passwords are bad, Next error logging and more - Theo - t3.gg](https://www.youtube.com/watch?v=5ppJsFztf8Y) 4:11:39s

## Shorts

- [5 Reasons I LOVE Astro! - James Q Quick](https://www.youtube.com/shorts/uivJzBdIlos)
- [Astro - The new META Framework? 😱 - Simon Grimm](https://www.youtube.com/shorts/nVM1hz0PwKg)
- [Using Astro.glob() to get markdown content in your Astro template - Bryan Robinson](https://www.youtube.com/shorts/2JjkedJIZNM)
- [Astro is the best framework for content rich websites - Cameron Blackwood](https://www.youtube.com/shorts/LzZ-eJBafys)

## Series

### Astro Blog Course #1 by [Coding in Public](https://www.youtube.com/@CodinginPublic)

#### [Playlist](https://www.youtube.com/playlist?list=PLoqZcxvpWzzeRwF8TEpXHtO7KYY6cNJeF)

- [Astro Blog Course #1 - Intro and Installation](https://www.youtube.com/watch?v=F2pw1C9eKXw) 10:48s
- [Astro Blog Course #2 - Astro Basics](https://www.youtube.com/watch?v=JFHmIp58YOU) 10:27s
- [Astro Blog Course #3 - Layouts](https://www.youtube.com/watch?v=rK-rNRPyET0) 9:58s
- [Astro Blog Course #4 - CSS & styling](https://www.youtube.com/watch?v=KNtax5dHPfI) 12:13s
- [Astro Blog Course #5 - Astro Components](https://www.youtube.com/watch?v=-d7L2n6y5PU) 21:36s
- [Astro Blog Course #6 - Routing basics](https://www.youtube.com/watch?v=TnZ8MkddAUA) 10:26s
- [Astro Blog Course #7 - Markdown layouts](https://www.youtube.com/watch?v=39qi3YxyiX8) 19:45s
- [Astro Blog Course #8 - Card component](https://www.youtube.com/watch?v=cH4SdQfoFPU) 14:14s
- [Astro Blog Course #9 - Filter/sort posts](https://www.youtube.com/watch?v=Eq0j71oLsFs) 14:40s
- [Astro Blog Course #10 - Dynamic routes](https://www.youtube.com/watch?v=qEo4NSObLwg) 15:28s
- [Astro Blog Course #11 - Pagination](https://www.youtube.com/watch?v=j_kWnI8rdLA&) 9:06s
- [Astro Blog Course #12 - Tag cloud](https://www.youtube.com/watch?v=AP2UD0wetAI) 10:26s
- [Astro Blog Course #13 - Related posts](https://www.youtube.com/watch?v=S3cX_zJ8_Kw) 7:52s
- [Astro Blog Course #14 - Build a sitemap](https://www.youtube.com/watch?v=8-qm9A24U9s) 3:41s
- [Astro Blog Course #15 - Build an RSS feed](https://www.youtube.com/watch?v=1Ep0gtED2wk) 7:21s
- [Astro Blog Course #16 - SEO basics](https://www.youtube.com/watch?v=fPifaHiKzz4) 14:50s
- [Astro Blog Course #17 - Integrations (React, Tailwind, CMS, and more)](https://www.youtube.com/watch?v=VzU_yqmIuPM) 11:50s
- [Astro Blog Course #18 - Build, deploy, and update](https://www.youtube.com/watch?v=TIlghu35niY) 5:06s

### Build a Static Site with Figma & Astro by [The Net Ninja](https://www.youtube.com/@NetNinja)

#### [Playlist](https://www.youtube.com/playlist?list=PL4cUxeGkcC9hZm9NYpd4G-jhoeEk0ls--)

- [Build a Static Site with Figma & Astro #1 - Introduction](https://www.youtube.com/watch?v=jyjScZWgzIg) 3:33s
- [Build a Static Site with Figma & Astro #2 - Design System](https://www.youtube.com/watch?v=2t8XC0VI1UQ) 20:30s
- [Build a Static Site with Figma & Astro #3 - Designing the Layout](https://www.youtube.com/watch?v=33As9ks4iF4) 27:03s
- [Build a Static Site with Figma & Astro #4 - Figma Plugins & Final Design](https://www.youtube.com/watch?v=rgZqUrAdY0k) 21:16s
- [Build a Static Site with Figma & Astro #5 - Astro Intro & Setup](https://www.youtube.com/watch?v=DLTVZFzjPDs) 8:14s
- [Build a Static Site with Figma & Astro #6 - Astro Structure & Components](https://www.youtube.com/watch?v=0xiMkffs87g) 23:32s
- [Build a Static Site with Figma & Astro #7 - CSS Setup & Open Props](https://www.youtube.com/watch?v=GBrYC49gYgc) 46:19s
- [Build a Static Site with Figma & Astro #8 - Infinite Slider](https://www.youtube.com/watch?v=IvRf6JqAmWE) 35:22s
- [Build a Static Site with Figma & Astro #9 - Finishing up & Deployment](https://www.youtube.com/watch?v=0PoKUrILs4U) 23:59s

### Astro Crash Course by [Little Sticks](https://www.youtube.com/@LittleSticks)

#### [Playlist](https://www.youtube.com/playlist?list=PLtLXFsdHI8JSX0qJsHfMDSTR3taqvXa5S)

- [Astro Crash Course #1 - Layouts, Astro Components, Styles, & Pages](https://www.youtube.com/watch?v=cbYr75_R15M) 23:46s
- [Astro Crash Course #2 - Images, React and Svelte Components, & Blog Posts](https://www.youtube.com/watch?v=xcDUpe1NfCQ) 27:10s
- [Astro Crash Course #3 - API Data Fetching, Components in Markdown, Pagination, RSS, & Hosting](https://www.youtube.com/watch?v=9wXdv7rHW2w) 22:06s
- [Astro Crash Course #4 - How to Add Categories/Tags To Blog Posts](https://www.youtube.com/watch?v=m50ITGl8tPI) 27:06s
- [Astro Crash Course #5 - Upgrading to Astro v1.0, Using Astro's Image Integration](https://www.youtube.com/watch?v=ZWcan5m2dP4) 25:38s

### Astro JS Tutorial Series by [Stefan Rows](https://www.youtube.com/@StefanRows)

- [Astro JS Tutorial Series #1 - Getting Started with Astro 🧑‍🚀](https://www.youtube.com/watch?v=BWfpDEVl70A) 36:35s
- [Astro JS Tutorial Series #2 - Styling and Components 🧑‍🚀](https://www.youtube.com/watch?v=8ZJ5jkwInKo) 15:36s
- [Astro JS Tutorial Series #3 - Astro Layouts and Tailwind CSS 🧑‍🚀](https://www.youtube.com/watch?v=WabTaFjSy1g) 26:47s

### Astro LinkTree Clone Series by [Stefan Rows](https://www.youtube.com/@StefanRows)

- [Astro LinkTree Clone Part #1 - Let''s Build! 🧑‍🚀](https://www.youtube.com/watch?v=DvWthdUtmhc) 45:47s
- [Astro LinkTree Clone Part #2 - Netlify CMS Integration 🧑‍🚀](https://www.youtube.com/watch?v=tn9vUFJUx9k) 30:08s

### Build A Website with Astro, TailwindCSS and React by [Web Dev Fuel](https://www.youtube.com/@webdevfuel)

- [Build A Website with Astro, TailwindCSS and React (#1 - Initial Setup, Home Page and Posts)](https://www.youtube.com/watch?v=eVjk3RP8ElE) 1:28:42s
- [Build A Website with Astro, TailwindCSS and React (#2 - Header Dropdown and Contact Form)](https://www.youtube.com/watch?v=JUIf_4tPUuQ) 48:47s
- [Build A Website with Astro, TailwindCSS and React (#3 - Mobile Header)](https://www.youtube.com/watch?v=hy4zTUSzGOU) 23:24s
- [Build A Website with Astro, TailwindCSS and React (#4 - Taxonomies and Authors)](https://www.youtube.com/watch?v=8z0AyPqKf9M) 30:09s

## Chris Bongers on Integrating Typesense search to an Astro static website by [Aviyel](https://www.youtube.com/@AviyelHq)

- [Chris Bongers on Integrating Typesense search to an Astro static website Part 1](https://www.youtube.com/watch?v=LU5utR5S6Bc)
- [Chris Bongers on Integrating Typesense search to an Astro static website Part 2](https://www.youtube.com/watch?v=Cx9fXvzNbWk)

### Porting my Next.js blog to Astro by [Parasocial Fix](https://www.youtube.com/@ParasocialFix)

- [Porting my Next.js blog to Astro (no React challenge)](https://www.youtube.com/watch?v=Xl4hWu4WFOM) 2:40:32s
- [Porting my Next.js blog to Astro (part 2)](https://www.youtube.com/watch?v=EU1MLQMUeXw) 1:40:49s
- [Porting my Next.js blog to Astro (part 3)](https://www.youtube.com/watch?v=2zsmo5uRpK8) 2:54:13s

### Building SPA with Astro 1.0 Beta by [Parasocial Fix](https://www.youtube.com/@ParasocialFix)

- [Astro 1.0 Beta Release: creating Markdown Blog with React SPA](https://www.youtube.com/watch?v=TD0N2Wa8964) 2:11:20s
- [Astro 1.0 Beta in SPA mode (part 2)](https://www.youtube.com/watch?v=yLmD7BZCY4Q) 2:10:14s
- [Astro 1.0 Beta in SPA mode (part 3)](https://www.youtube.com/watch?v=kSgRvK0xWLw) 2:26:38s
- [Astro 1.0 Beta in SPA mode (part 4)](https://www.youtube.com/watch?v=_y5hbSvVVAs) 2:22:23s

### sBird (React app in Astro) to xBird (XElement in Astro) by [Sarah Rainsberger](https://www.youtube.com/@SarahRainsberger)

- [PART 1: sBird (React app in Astro) to xBird (XElement in Astro) - Introduction](https://www.youtube.com/watch?v=0-aH18YH2SQ) 18:28s
- [PART 2: sBird (React app in Astro) to xBird (XElement in Astro) - xBird Page HTML](https://www.youtube.com/watch?v=MAwcuEkIOTU) 21:24s
- [PART 3: sBird (React app in Astro) to xBird (XElement in Astro) - xElement Button Components](https://www.youtube.com/watch?v=rY6PaSHmopU) 33:16s
- [PART 4: sBird (React app in Astro) to xBird (XElement in Astro) - xElement Rendering Birds](https://www.youtube.com/watch?v=H-cENeTjBis) 23:08s
- [PART 5: sBird (React app in Astro) to xBird (XElement in Astro) - location in "store"](https://www.youtube.com/watch?v=UtIw6H7vWZM) 40:56s
- [PART 6: sBird (React app in Astro) to xBird (XElement in Astro) - "Reactivity" in XElements](https://www.youtube.com/watch?v=sgPryBtQt9g) 1:23:02s
- [PART 7: sBird (React app in Astro) to xBird (XElement in Astro) - SUMMARY OF WEEK 2](https://www.youtube.com/watch?v=5Yc23Ruzy08) 12:09s
- [PART 8: sBird (React app in Astro) to xBird (XElement in Astro) - Nested elements!](https://www.youtube.com/watch?v=wbqKZMQmZFU) 1:12:36s

## Astro series by [Incredible](https://www.youtube.com/@Incredibledev)

#### [Playlist](https://www.youtube.com/playlist?list=PLxre725hUHg5KyLn0G3It7Y-8OXNEDFSm)

- [Setting up Astro | Getting started with Astro: Episode 1](https://www.youtube.com/watch?v=k4buoZsMuNU) 3:11s
- [Astro project structure | Getting started with Astro: Episode 2](https://www.youtube.com/watch?v=d3_D41WWmx8) 1:26s
- [Astro project structure part 2 | Getting started with Astro: Episode 3](https://www.youtube.com/watch?v=qvIiTKs4c18) 2:35s
- [Introduction to components and basic syntax | Getting started with Astro: Episode 4](https://www.youtube.com/watch?v=fksi0dv2_Uc) 2:06s
- [Astro CSS Styles | Getting started with Astro: Episode 5](https://www.youtube.com/watch?v=kKJ-feytkMM) 1:23s
- [Front matter script in Astro | Getting started with Astro: Episode 6](https://www.youtube.com/watch?v=K_EOwSdSvLk) 1:04s
- [Importing Astro components | Getting started with Astro: Episode 7](https://www.youtube.com/watch?v=CiU7MP4OitY) 1:44s
- [Component Props | Getting started with Astro: Episode 8](https://www.youtube.com/watch?v=fZjIlF8HFTk) 3:58s
- [Slots in Astro - Part 1| Getting started with Astro: Episode 9](https://www.youtube.com/watch?v=6paRLWA1lpM) 5:51s
- [Slots in Astro - Part 2 | Getting started with Astro: Episode 10](https://www.youtube.com/watch?v=ATfyUXglvkk) 3:07s
- [Static routes in Astro | Getting started with Astro: Episode 11](https://www.youtube.com/watch?v=Q3RqVesUnDg) 3:08s
- [Dynamic routes in Astro - Part 1 | Getting started with Astro: Episode 12](https://www.youtube.com/watch?v=NyX46APoSdg) 4:55s

## Official Astro Videos

### Community Calls

- 01/12/2023 [Astro Community Call 17th Jan 23](https://www.youtube.com/watch?v=yXX9gvgXl_Q) 13:38s
- 01/10/2023 [Astro Community Call 10th January 2023](https://www.youtube.com/watch?v=NhAD29VAZIw) 26:35s
- 01/02/2023 [Astro Community Call 3rd January 2023](https://www.youtube.com/watch?v=IZVMHgKIxCQ) 48:01s
- 12/20/2022 [Astro Communuty Call 20th Dec 22](https://www.youtube.com/watch?v=dUHhSzA5zaI) 29:59s
- 12/13/2022 [Community Call 13th Dec 22](https://www.youtube.com/watch?v=PJO8d14P2V0) 1:00:3s
- 12/06/2022 [Astro Community Call 6th Dec 22](https://www.youtube.com/watch?v=RUdX8rTIxIE) 26:33s
- 11/29/2022 [Astro Community Call 29th Nov 22](https://www.youtube.com/watch?v=sIxOFWxJbGY) 53:25s
- 11/16/2022 [Astro Community Call 16th Nov](https://www.youtube.com/watch?v=wnAGBk8OegM) 1:00:21s
- 10/19/2022 [Community Call 19th October 2022](https://www.youtube.com/watch?v=6MnIORimV94) 25:33s
- 10/04/2022 [Community Call - 4th October 22](https://www.youtube.com/watch?v=_0IQIsSKbyM) 50:48s
- 09/27/2022 [Astro Community Call - 27th Sept 2022](https://www.youtube.com/watch?v=d21zkBfI994) 1:02:37s
- 09/20/2022 [Astro Community Call - 20th Sept 22](https://www.youtube.com/watch?v=raDGO3HLmas) 56:30s
- 09/13/2022 [Community Call 13th September 22](https://www.youtube.com/watch?v=RlQqB3oFf_Q) 51:27s
- 06/28/2022 [Astro Community Call: June 28](https://www.youtube.com/watch?v=r2Cg6w1xA1c) 51:13s
- 08/31/2021 [Astro RFC Call 8/31/2021](https://www.youtube.com/watch?v=hhsKS2et8Jk) 50:58s

### This Week in Astro

- 10/19/2022 [This Week In Astro 19-10-2022](https://www.youtube.com/watch?v=4jJCqXfTynA) 25:33s
- 10/09/2022 [This Week In Astro - 9th of October](https://www.youtube.com/watch?v=HBn9nznkjh8) 27:59s
- 10/02/2022 [This Week in Astro - 2nd Oct](https://www.youtube.com/watch?v=KqsNlI__BW4) 35:45s
- 09/26/2022 [This Week In Astro - 26th Sept](https://www.youtube.com/watch?v=tKAsgqG4gUQ) 30:17s
- 09/11/2022 [This Week In Astro 11th Sept 22](https://www.youtube.com/watch?v=OgqIQwPd3uQ) 48:20s
- 06/29/2022 [This Week in Astro: Week Ending 29th June](https://www.youtube.com/watch?v=uZtM4P4TkkU) 47:41s
- 06/06/2022 [This Week in Astro: Week of June 6](https://www.youtube.com/watch?v=eOd5jlJCfRo) 26:01s
- 06/05/2022 [This Week in Astro! (2022-06-05)](https://www.youtube.com/watch?v=zzjRO5aidME) 32:04s
- 05/29/2022 [This Week in Astro! (2022-05-29)](https://www.youtube.com/watch?v=W2CZ0ankgUo) 26:41s
- 05/22/2022 [This Week in Astro! (2022-05-22)](https://www.youtube.com/watch?v=4lGzNuxUcws) 17:05s
- 05/15/2022 [This Week in Astro! (2022-05-15)](https://www.youtube.com/watch?v=w3o1nJXbPFk) 23:54s
- 05/08/2022 [This Week in Astro! (2022-05-08)](https://www.youtube.com/watch?v=sYkpaTFCf9w) 32:54s
- 05/01/2022 [This Week in Astro! (2022-05-01)](https://www.youtube.com/watch?v=fNRv6ifx6AM) 5:58s
- 04/24/2022 [This Week in Astro! (2022-04-24)](https://www.youtube.com/watch?v=xCvepKXw0V0) 30:31s
- 04/17/2022 [This Week in Astro! (2022-04-17)](https://www.youtube.com/watch?v=93t6-cHSqYU) 21:16s
- 04/10/2022 [This Week in Astro! (2022-04-10)](https://www.youtube.com/watch?v=xtTy5nKay_Y) 28:23s
- 04/03/2022 [This Week in Astro! (2022-04-03)](https://www.youtube.com/watch?v=RrC-VCAOswg) 17:33s
- 03/27/2022 [This Week in Astro! (2022-03-27)](https://www.youtube.com/watch?v=1fjLLJEIabk) 26:39s
- 03/20/2022 [This Week in Astro! (2022-03-20)](https://www.youtube.com/watch?v=Qa7IfPZM43A) 23:40s
- 03/13/2022 [This Week in Astro! (2022-03-13)](https://www.youtube.com/watch?v=o-CrYwQo5aA) 23:39s

### Community Showcase

- 09/23/2022 [Community Showcase - 23rd Sept 22](https://www.youtube.com/watch?v=fACo3EMqbdg) 46:37s
- 08/02/2021 [Astro Demo Day - 08/02/2021](https://www.youtube.com/watch?v=E-Nd3n82kGo) 54:17s

